{
  "held_out": [
    {
      "cleanup_verified": true,
      "directory": "held_out/short",
      "project_name": "trafficlab-capture-fixture-held-out-short",
      "run_id": "held-out-short"
    },
    {
      "cleanup_verified": true,
      "directory": "held_out/streaming",
      "project_name": "trafficlab-capture-fixture-held-out-streaming",
      "run_id": "held-out-streaming"
    },
    {
      "cleanup_verified": true,
      "directory": "held_out/bursty",
      "project_name": "trafficlab-capture-fixture-held-out-bursty",
      "run_id": "held-out-bursty"
    }
  ],
  "phase_capture_image": {
    "capture_image_id": "sha256:704e90f23055657bb8ad7108bf6650b5e83fb2b711a1168725441599b8a73859",
    "cleanup_verified": true,
    "post_cleanup_inspect_exit_status": 1,
    "tag": "trafficlab-validation-fixture-study:collection-capture"
  },
  "schema_version": 1,
  "study_id": "fixture-study",
  "training": [
    {
      "cleanup_verified": true,
      "directory": "training/short/r1",
      "project_name": "trafficlab-capture-fixture-short-r1",
      "run_id": "01-short-r1"
    },
    {
      "cleanup_verified": true,
      "directory": "training/streaming/r1",
      "project_name": "trafficlab-capture-fixture-streaming-r1",
      "run_id": "02-streaming-r1"
    },
    {
      "cleanup_verified": true,
      "directory": "training/bursty/r1",
      "project_name": "trafficlab-capture-fixture-bursty-r1",
      "run_id": "03-bursty-r1"
    },
    {
      "cleanup_verified": true,
      "directory": "training/streaming/r2",
      "project_name": "trafficlab-capture-fixture-streaming-r2",
      "run_id": "04-streaming-r2"
    },
    {
      "cleanup_verified": true,
      "directory": "training/bursty/r2",
      "project_name": "trafficlab-capture-fixture-bursty-r2",
      "run_id": "05-bursty-r2"
    },
    {
      "cleanup_verified": true,
      "directory": "training/short/r2",
      "project_name": "trafficlab-capture-fixture-short-r2",
      "run_id": "06-short-r2"
    },
    {
      "cleanup_verified": true,
      "directory": "training/bursty/r3",
      "project_name": "trafficlab-capture-fixture-bursty-r3",
      "run_id": "07-bursty-r3"
    },
    {
      "cleanup_verified": true,
      "directory": "training/short/r3",
      "project_name": "trafficlab-capture-fixture-short-r3",
      "run_id": "08-short-r3"
    },
    {
      "cleanup_verified": true,
      "directory": "training/streaming/r3",
      "project_name": "trafficlab-capture-fixture-streaming-r3",
      "run_id": "09-streaming-r3"
    }
  ]
}
